{
  "version": 4,
  "base_version": 3,
  "addressed": [
    {"issue": "I-03", "change": "جمله‌ی بی‌پشتوانه‌ی S11 («در پایلوت فقط نمونه‌ی ناشناس‌شده ... استفاده می‌شود») با آنچه C-10 می‌گوید جایگزین شد (وابستگی به دسترسی آزمایشی به نمونه‌ی ناشناس‌شده). محدود ماندن به همین نمونه حالا یک کنترل «پیشنهادی» و برنامه‌ریزی‌شده است. خروجی آزمون داخلی در ورودی نیست؛ در S14 با [نامعلوم] و ردیف U-18 مانده است."},
    {"issue": "I-10", "change": "همه‌ی ارجاع‌های (U-xx) از متن اصلی حذف شد. ارجاع‌های تکراری C کم شد و هر واقعیت در هر بند یک بار ارجاع دارد. جدول unknowns از ۲۴ به ۱۸ ردیف رسید و نامعلوم‌های تکراری در آن ادغام شدند. در جدول‌های data هم به‌جای شناسه‌ی U، برچسب کوتاه موضوع آمده است."},
    {"issue": "I-12", "change": "متن بخش‌ها و فیلدهای جدول‌های data (زمان‌بندی، ریسک، نقش‌ها، معیارها، پذیرش، نامعلوم‌ها) کوتاه شد تا طول به بودجه‌ی ۱۰۰۰ تا ۳۲۰۰ کلمه نزدیک شود. شناسه‌ها، must_include و برچسب‌های [نامعلوم] الزامی بریف حفظ شدند."}
  ],
  "not_addressed": [
    {"issue": "I-01", "reason": "اطلاعات ورودی نیست: بودجه، مبلغ، درصد پرداخت‌ها و تأیید مالک در ورودی نیست. تنها تغییر این است که مبنای «زمان با سقف توافقی» در P-01 با برچسب پیشنهادیِ تأییدنشده آمد و هیچ مبلغ یا درصدی ساخته نشد."},
    {"issue": "I-02", "reason": "اطلاعات ورودی نیست: هیچ درصد پرداختی توافق نشده است. پر کردن جدول پرداخت برای رسیدن به جمع ۱۰۰ یعنی ساختن شرایط تجاری، پس payments خالی ماند و موضوع در ردیف U-05 ثبت شد."},
    {"issue": "I-04", "reason": "اطلاعات ورودی نیست: ظرفیت ساعتی بازبین، مسئول داده و مدت مراحل در ورودی نیست؛ duration_workdays همچنان null است (U-07، U-11)."},
    {"issue": "I-05", "reason": "اطلاعات ورودی نیست: مسئول داده‌ی مشتری و پاسخ‌های محل پردازش، نگهداری، حذف و رخداد در ورودی نیست (U-13)."},
    {"issue": "I-06", "reason": "اطلاعات ورودی نیست: حجم درخواست‌ها و نرخ اصلاح فعلی را فقط مدیر فروش می‌تواند بدهد. در S03 همچنان [نامعلوم] است و ردیف U-09 دارد."},
    {"issue": "I-07", "reason": "اطلاعات ورودی نیست: دسته‌ی محصول و قالب و موعد تحویل‌ها تعیین نشده است (U-07، U-10)."},
    {"issue": "I-08", "reason": "اطلاعات ورودی نیست: تأیید مالک و ابزار ثبت کار مدیر فروش است. تقسیم کار همچنان با برچسب «پیشنهادی» آمده است (U-11)."},
    {"issue": "I-09", "reason": "اطلاعات ورودی نیست: تعداد بازنگری و بازه‌ی اصلاح توافق نشده است. تعریف پیشنهادی بازنگری در S10 ماند و موضوع در ردیف‌های U-14 و U-16 ثبت است."},
    {"issue": "I-11", "reason": "اطلاعات ورودی نیست: تاریخ دقیق «پایان ماه» در ورودی نیست. [نامعلوم: تاریخ] ماند و ردیف U-03 دارد."}
  ],
  "summary": "دور ۴ از document.v3: ادعای بی‌پشتوانه‌ی S11 اصلاح شد، ارجاع‌های U از متن حذف و نامعلوم‌ها در ۱۸ ردیف ادغام شدند و متن و جدول‌ها برای بودجه‌ی طول کوتاه شدند. ایرادهای قیمت، پرداخت، ظرفیت، مسئول داده و تاریخ به اطلاعات تازه از مدیر فروش نیاز دارند و بدون ساختن داده رفع نشدند. meta.revision همان ۱ ماند."
}
