{
  "version": 1,
  "base_version": null,
  "addressed": [],
  "not_addressed": [],
  "summary": "دور اول: نوشتن از بریف، دفتر ادعا و شکاف‌ها. ۱۵ بخش به ترتیب بریف؛ همه‌ی مبلغ‌ها null و جمع‌ها null؛ فهرست پرداخت خالی ماند چون شرایط پرداخت در ورودی نیست (G-02) و درصد ساختگی نوشته نشد؛ cost_benefit بدون سناریو چون خط مبنا نیست؛ ۲۴ مورد نامعلوم با gap مرتبط. یادداشت داخلی دستوری در discovery_notes (G-11) داده تلقی شد و در سند نیامد."
}
