{
  "version": 3,
  "base_version": 1,
  "addressed": [
    {"issue": "I-03", "change": "جمله‌ی بی‌پشتوانه‌ی «قیمت پکیج‌ها قدیمی…» در کال‌اوت S09 حذف شد. به‌جایش جمله‌ای درباره‌ی خود سند آمد: از قیمت پکیج‌های عمومی برند استفاده نشده و چنین قیمتی بدون تأیید تازه قیمت پایلوت نیست. در S14 نبودِ خروجی آزمون داخلی ذکر شد و U-23 گسترش یافت. نمونه‌ی مرتبط یا خروجی آزمون اضافه نشد، چون در ورودی نیست."},
    {"issue": "I-04", "change": "برای M-01 و M-02 مالک و ثبت‌کننده‌ی پیشنهادی آمد (مالک: مدیر فروش؛ ثبت: بازبین تیم فروش) و ابزار پیشنهادی برگه‌ی ثبت مشترک است؛ هر دو برچسب «پیشنهادی» دارند و در D-01 تأیید می‌شوند (U-07). دوره‌ی سنجش به T-04 و T-06 وصل شد. مدت دوره هنوز نامعلوم است (U-04). هدف پس از مبنا ماند."},
    {"issue": "I-05", "change": "در جدول نقش‌ها، مجری پیشنهادی ثبت ایراد و تغییر دامنه و گام نخست پیشنهادیِ حل اختلاف آمد. پیگیری داده تا تعیین مسئول داده با مدیر فروش است. ثبت زمان بازبینی به کار بازبین افزوده شد. مدت مراحل null ماند، چون مدت و ظرفیت در ورودی نیست (U-04 و U-10). مرجع نهایی اختلاف در U-13 نامعلوم ماند."},
    {"issue": "I-06", "change": "برای K-01 تا K-03 مالک پیشنهادی نوشته شد و تأییدش به U-20 رفت. در S11 مسیر داده به‌صورت پرسش آمد، تصمیم‌گیرنده‌ی هر مورد (مسئول داده‌ی مشتری) ذکر شد و کنترل‌های پیشنهادی با برچسب «برنامه‌ریزی‌شده، نه اجراشده» اضافه شدند. محل پردازش، سرویس ثالث، نگهداری و حذف نامعلوم ماندند (U-19)."},
    {"issue": "I-09", "change": "این‌ها با برچسب پیشنهادی و منوط به تأیید در D-01 اضافه شدند: تعریف خطای بحرانی در S13 و A-02، روش ثبت ایراد با فهرست ایراد مشترک در S13 و retest، تعریف «بازنگری» و روش ثبت تغییر دامنه در S10. تعداد بازنگری در U-17 نامعلوم ماند. شرط الزامیِ «بدون ارسال بدون تأیید انسان» و منع پذیرش با سکوت که R04 نسخه‌ی ۱ بر آن استوار بود، دست نخورد."},
    {"issue": "I-10", "change": "هر [نامعلوم: …] در متن و جدول‌ها به شناسه‌ی U در جدول S15 ارجاع دارد. تکرارهای طولانی در جدول‌های data به «[نامعلوم: U-xx]» کوتاه شد. در S03 دو فهرست نامعلوم ادغام شد. جاهای خالی‌ای که بریف صریحاً خواسته، با همان متن و شناسه‌ی U ماندند."},
    {"issue": "I-12", "change": "متن بخش‌ها از نسخه‌ی ۱ شروع شد، نه از نسخه‌ی ۲ که ۴۴۰۰ کلمه بود. تکرارهای S03، S06 و S12 و خانه‌های جدول‌ها فشرده شد تا افزوده‌های پیشنهادی جبران شود. شمار کلمه‌ها با ابزار سنجیده نشده است."}
  ],
  "not_addressed": [
    {"issue": "I-01", "reason": "اطلاعات ورودی نیست (G-01، G-02، C-16): بودجه، مبلغ، واحد، ارز، مالیات و شرایط پرداخت داده نشده است. فقط این‌ها اضافه شد: دو گزینه‌ی مبنای قیمت (ثابت یا زمان با سقف توافقی) با برچسب «تأییدنشده» در S09 و P-01، و پیشنهاد اینکه هر پرداخت به پذیرش D-01 تا D-03 وصل شود. سقفِ علت (CHK-PAY-PERCENT) باقی است."},
    {"issue": "I-02", "reason": "درصد پرداخت‌ها در ورودی نیست (G-02، U-14). ساختن ردیف پرداخت با درصد ساختگی یعنی جعل شرایط تجاری، برای همین payments خالی ماند و در S09 علت آن نوشته شد. پیش از رفع، مدیر فروش و تیم مجری باید نقاط و درصدها را تعیین کنند."},
    {"issue": "I-07", "reason": "اطلاعات ورودی نیست: زمان میانه‌ی بازبینی، حجم درخواست‌ها و تاریخ جلسه‌ی کشف باید از مدیر فروش گرفته شود (U-05 و U-06)."},
    {"issue": "I-08", "reason": "اطلاعات ورودی نیست: دسته‌ی محصول و قالب و موعد D-01 تا D-03 داده نشده است (U-08 و U-09). فقط تعریف خطای بحرانی به محتوای D-01 افزوده شد."},
    {"issue": "I-11", "reason": "اطلاعات ورودی نیست: تاریخ سند و تاریخ دقیق «پایان ماه» در ورودی نیست. meta.date و U-24 نامعلوم ماندند و تاریخی ساخته نشد."}
  ],
  "summary": "دور سوم، روی نسخه‌ی ۱ (نه نسخه‌ی ۲ که R04 در آن پس رفت). ادعای بی‌پشتوانه‌ی قیمت پکیج حذف شد. برای شاخص‌ها، ریسک‌ها، نقش‌ها، خطای بحرانی، ثبت ایراد و تغییر دامنه، نقش و روش پیشنهادی با برچسب «پیشنهادی» و منوط به تأیید اضافه شد. نامعلوم‌ها به جدول U در S15 ارجاع یافتند و متن فشرده شد. قیمت، درصد پرداخت، مدت‌ها، تاریخ‌ها و proof به‌علت نبود اطلاعات ورودی نامعلوم ماندند. meta.revision همان ۱ ماند."
}
