{
  "version": 2,
  "base_version": 1,
  "addressed": [
    {"issue": "I-03", "change": "کال‌اوت S09 بازنویسی شد: جمله‌ی بی‌پشتوانه «قیمت پکیج‌های منتشرشده … قدیمی است» حذف و به قاعده‌ی سند تبدیل شد («مبنای این پیشنهاد نیست و بدون تأیید تازه به کار نمی‌رود»). بخش proof همچنان به U-23 وابسته است؛ نمونه‌ی مرتبط یا خروجی آزمون در ورودی نیست و ساخته نشد."},
    {"issue": "I-09", "change": "در S10 و S13 صریح شد که تعداد بازنگری، روش ثبت تغییر، تعریف خطای بحرانی و روش ثبت ایراد در سند قیمت و برنامه، پیش از امضا، نوشته می‌شوند؛ موعد U-17 و U-21 همین شد. خودِ تعریف‌ها در ورودی نیست و ساخته نشد."},
    {"issue": "I-10", "change": "نامعلوم‌های تکراری در جدول U (S15) متمرکز شدند؛ جدول‌های data و ارجاع‌های تکراری متن فقط به شناسه‌ی U اشاره می‌کنند و جای‌خالی‌های الزامی بریف یک بار با شناسه‌ی U آمده‌اند."},
    {"issue": "I-12", "change": "متن و جدول‌ها کوتاه شد: جای‌خالی‌های طولانی تکراری با شناسه‌ی U جایگزین شد، پرسش‌های جدول U و ردیف‌های زمان‌بندی، ریسک، نقش و پذیرش فشرده شد و جمله‌های تکراری S03، S07، S09 و S13 حذف شد."}
  ],
  "not_addressed": [
    {"issue": "I-01", "reason": "اطلاعات ورودی نیست: بودجه، مبلغ، واحد، مالیات و شرایط پرداخت در ورودی نیامده (G-01، G-02، C-16) و بریف آن‌ها را خارج از دامنه‌ی این نسخه می‌داند. بهبود جزئی بدون ساختن داده: دو گزینه‌ی مبنای قیمت (ثابت یا زمان با سقف) برای تصمیم آمد و پیشنهاد اتصال هر پرداخت به پذیرش A-01 تا A-03 یا امضای سند قیمت روشن‌تر شد."},
    {"issue": "I-02", "reason": "اطلاعات ورودی نیست: درصد و نقاط پرداخت تعیین نشده (G-02، U-14). ساختن درصد یا یک پرداخت ۱۰۰٪ با رویداد نامعلوم فقط برای عبور از چک، ساختن شرط تجاری است؛ جدول پرداخت خالی ماند و در متن S09 دلیلش آمده است."},
    {"issue": "I-04", "reason": "اطلاعات ورودی نیست: مالک، ابزار و مدت سنجش در ورودی نیست و بریف نقش‌ها را فقط از ورودی مجاز می‌داند (U-07، U-04). بهبود جزئی: ساختار دوره‌ی سنجش (مبنا در T-04، مقایسه در T-06) در S04 و جدول شاخص‌ها آمد؛ هدف همچنان پس از مبنا است."},
    {"issue": "I-05", "reason": "اطلاعات ورودی نیست: مدت مراحل، نام یا نقش بازبین، مسئول داده و مسیر اختلاف تعیین نشده (G-09، G-10؛ U-04، U-10، U-12، U-13). برآورد روز کاری بدون ورودی ساخته نشد."},
    {"issue": "I-06", "reason": "اطلاعات ورودی نیست: مسیر داده و مسئول داده (G-04؛ U-12، U-19) و مالک K-01 تا K-03 در ورودی نیست و بریف مالک را [نامعلوم] خواسته است؛ مالک ساخته نشد."},
    {"issue": "I-07", "reason": "اطلاعات ورودی نیست: زمان میانه‌ی بازبینی، حجم درخواست‌ها و تاریخ جلسه‌ی کشف در ورودی نیست (C-04، U-05، U-06)."},
    {"issue": "I-08", "reason": "اطلاعات ورودی نیست: دسته‌ی محصول و قالب و موعد D-01 تا D-03 تعیین نشده (U-08، U-09)."},
    {"issue": "I-11", "reason": "اطلاعات ورودی نیست: تاریخ سند در ورودی نیامده و از ورودی گرفته نشد؛ در meta.date و S01 همچنان [نامعلوم: تاریخ سند] (U-01) است. تاریخ دقیق «پایان ماه» هم در ورودی نیست (U-24) و برداشت شرطی از آن نوشته نشد."}
  ],
  "summary": "دور دوم از نسخه‌ی ۱: ادعای بی‌پشتوانه‌ی قیمت پکیج‌ها حذف شد، نامعلوم‌ها در جدول U متمرکز و متن کوتاه شد و زمان تعیین خطای بحرانی و تعداد بازنگری روشن شد. meta.revision مثل نسخه‌ی پایه ۱ ماند. تاریخ سند از ورودی گرفته نشد و نامعلوم ماند. ایرادهای قیمت، پرداخت، مالک‌ها، مدت‌ها، مسیر داده و تاریخ‌ها به اطلاعات تازه از مدیر فروش و تیم مجری وابسته‌اند و هیچ عدد، تاریخ یا شرطی ساخته نشد."
}
